### ISSUE TITLE
Is Goldfish Proxy-Aware?

### ISSUE THREAD

**Issue by TuxOtaku** [Caiyeon/goldfish#199]
Hey everyone,

So I'm running Goldfish in an environment where all outbound traffic has to go through a proxy, and I'm trying to use the Slack webhook. Is there any config option I can pass to Goldfish to tell it where to proxy through?

**Comment by Caiyeon** [comment]
Goldfish follows the system's proxy, because it uses the default go http package. Code can be found here https://github.com/Caiyeon/goldfish/blob/master/slack/slack.go

In other words, if `curl` respects the proxy, so will goldfish.

**Comment by Caiyeon** [comment]
I presume this is no longer an issue. If goldfish is not respecting proxy environment variables, please re-open this or create a new issue :)

**Comment by TuxOtaku** [comment]
Re-opening. Ran a test with tshark, Goldfish is attempting to make a direct connection to hooks.slack.com instead of hitting the proxy:

```
[root@<redacted> ~]# tshark -i eth0 -nlp -f webhooks-$(date +%s).pcap -P -f "net 34.192.0.0/10 or host <proxy1> or host <proxy2>"
Running as user "root" and group "root". This could be dangerous.
Capturing on 'eth0'
  1 0.000000000 <goldfish_host> -> 34.200.48.200 TCP 74 45210 > 443 [SYN] Seq=0 Win=29200 Len=0 MSS=1460 SACK_PERM=1 TSval=2058579092 TSecr=0 WS=128
  2 1.001546614 <goldfish_host> -> 34.200.48.200 TCP 74 [TCP Retransmission] 45210 > 443 [SYN] Seq=0 Win=29200 Len=0 MSS=1460 SACK_PERM=1 TSval=2058580094 TSecr=0 WS=128
  3 3.003567850 <goldfish_host> -> 34.200.48.200 TCP 74 [TCP Retransmission] 45210 > 443 [SYN] Seq=0 Win=29200 Len=0 MSS=1460 SACK_PERM=1 TSval=2058582096 TSecr=0 WS=128
  4 3.749213281 <goldfish_host> -> 34.200.72.115 TCP 74 48462 > 443 [SYN] Seq=0 Win=29200 Len=0 MSS=1460 SACK_PERM=1 TSval=2058582841 TSecr=0 WS=128
  5 4.751527924 <goldfish_host> -> 34.200.72.115 TCP 74 [TCP Retransmission] 48462 > 443 [SYN] Seq=0 Win=29200 Len=0 MSS=1460 SACK_PERM=1 TSval=2058583844 TSecr=0 WS=128
```

**Comment by Caiyeon** [comment]
Did you set the proper environment variables? If I set a proxy env var I get `proxyconnect tcp: dial tcp: lookup proxy: no such host` which means it is in fact trying to reach the proxy first.

**Comment by TuxOtaku** [comment]
yes, the proxy environment has been properly set.

**Comment by Caiyeon** [comment]
what happens when you do a manual request using `curl`? is the proxy being used in that case?

**Comment by TuxOtaku** [comment]
yes, `curl` honours the proxy. 

```
[goldfish@XXXXXXX ~]$ curl -X POST --data-urlencode "payload={\"text\": \"Ook Ook\"}" https://hooks.slack.com/services/XXXXXXXX/XXXXXXXX/xxxxxxxxxxxxxxxxxxxxxxxx
ok[goldfish@XXXXXXXX ~]$

**Comment by Caiyeon** [comment]
In this case, is goldfish being launched with the same environment variables? The http package is aware of env variables just like curl. If you launched goldfish with `sudo`, the environment variables will not be passed through. Likewise with systemd or certain scripts.

**Comment by TuxOtaku** [comment]
Yep, looks like it was systemd at fault here. Thanks for the help!!
